"","year","accomplishment","person","gender","category","female","row_num","p_count","p_flag","person_c"
"122",1931,"First African-American woman to graduate from Yale Law School","Jane Matilda Bolin","Female African American Firsts","Law",1,122,0,0,"Jane Matilda Bolin"
"123",1932,"First African-American on a presidential ticket in the 20th century","James W. Ford","African-American Firsts","Politics",0,123,1,0,"James W. Ford"
"124",1934,"First African-American elected to the U.S. House of Representatives as a Democrat","Arthur W. Mitchell","African-American Firsts","Politics",0,124,1,0,"Arthur W. Mitchell"
"125",1934,"First trade union set up for African-American domestic workers by Dora Lee Jones","NANA","African-American Firsts","Politics",0,125,NA,0,"NANA"
"126",1935,"First known interracial jazz group","Benny Goodman Trio","African-American Firsts","Social & Jobs",0,126,0,0,"Benny Goodman Trio"
"127",1936,"First African-American to conduct a major U.S. orchestra","William Grant Still","African-American Firsts","Arts & Entertainment",0,127,0,0,"William Grant Still"
"128",1936,"First African-American women selected for the Olympic Games","Tidye Pickett and Louise Stokes.:86","African-American Firsts","Politics",0,128,1,0,"Tidye Pickett and Louise Stokes.:86"
"129",1937,"First African-American federal magistrate","William H. Hastie","African-American Firsts","Politics",0,129,1,0,"William H. Hastie"
"130",1938,"First African-American woman federal agency head","Mary McLeod Bethune","Female African American Firsts","Politics",1,130,0,0,"Mary McLeod Bethune"
"131",1938,"First African-American woman elected to a state legislature","Crystal Bird Fauset","Female African American Firsts","Politics",1,131,0,0,"Crystal Bird Fauset"
"132",1939,"First African-American to star in her own television program","Ethel Waters, The Ethel Waters Show, on NBC","Female African American Firsts","Arts & Entertainment",1,132,0,0,"Ethel Waters, The Ethel Waters Show, on NBC"
"133",1940,"First African-American to win an Oscar","Hattie McDaniel","African-American Firsts","Arts & Entertainment",0,133,0,0,"Hattie McDaniel"
"134",1940,"First African-American to be portrayed on a U.S. postage stamp","Booker T. Washington","African-American Firsts","Social & Jobs",0,134,1,0,"Booker T. Washington"
"135",1940,"First African-American flag officer","BG Benjamin O. Davis Sr., U.S. Army","African-American Firsts","Military",0,135,4,1,"BG Benjamin O. Davis Sr., U.S. Army."
"136",1941,"First African-American to give a White House Command Performance","Josh White","African-American Firsts","Military",0,136,0,0,"Josh White"
"137",1942,"First African-American to be awarded the Navy Cross","Doris Miller","African-American Firsts","Military",0,137,0,0,"Doris Miller"
"138",1942,"First African-American member of the U.S. Marine Corps","Alfred Masters","African-American Firsts","Military",0,138,0,0,"Alfred Masters"
"139",1943,"Martin A. Martin, first African-American to become a member of the Trial Bureau of the United States Department of Justice, was sworn in on May 31, 1943.","NANA","African-American Firsts","Politics",0,139,NA,0,"NANA"
"140",1943,"First African-American artists to have a #1 hit on the Billboard charts","Mills Brothers","African-American Firsts","Arts & Entertainment",0,140,0,0,"Mills Brothers"
"141",1944,"First African-American commissioned officers in the U.S. Navy","The Golden Thirteen","African-American Firsts","Military",0,141,0,0,"The Golden Thirteen"
"142",1944,"First African-American commissioned as a U.S. Navy officer from the Naval Reserve Officer Training Corps","Samuel Gravely","African-American Firsts","Military",0,142,1,0,"Samuel Gravely"
"143",1944,"First African-American to co-pastor with a white minister at the first interracial church","Dr. Howard Thurman with Dr. Alfred Fisk, Church for the Fellowship of All Peoples, San Francisco","African-American Firsts","Religion",0,143,2,0,"Dr. Howard Thurman with Dr. Alfred Fisk, Church for the Fellowship of All Peoples, San Francisco"
"144",1944,"First African-American to receive a contract with a major American opera company","Camilla Williams","African-American Firsts","Arts & Entertainment",0,144,0,0,"Camilla Williams"
"145",1944,"First known African-American comic book artist","Matt Baker in Jumbo Comics #69 for Fiction House","African-American Firsts","Arts & Entertainment",0,145,0,0,"Matt Baker in Jumbo Comics #69 for Fiction House"
"146",1944,"First African-American reporter to attend a U.S. presidential news conference","Harry McAlpin","African-American Firsts","Social & Jobs",0,146,0,0,"Harry McAlpin"
"147",1945,"First African-American member of the New York City Opera","Todd Duncan","African-American Firsts","Arts & Entertainment",0,147,0,0,"Todd Duncan"
"148",1945,"First African-American U.S. Marine Corps officer","Frederick C. Branch","African-American Firsts","Military",0,148,1,0,"Frederick C. Branch"
"149",1947,"First African-American Major League Baseball player of the modern era","Jackie Robinson","African-American Firsts","Education & Science",0,149,0,0,"Jackie Robinson"
"150",1947,"First African-American consensus college All-American basketball player","Don Barksdale","African-American Firsts","Education & Science",0,150,0,0,"Don Barksdale"
"151",1947,"First African-American artist to receive sole credit for a #1 hit on the Billboard charts","Count Basie","African-American Firsts","Arts & Entertainment",0,151,0,0,"Count Basie"
"152",1947,"First comic book produced entirely by African-Americans","All-Negro Comics","African-American Firsts","Arts & Entertainment",0,152,0,0,"All-Negro Comics"
"153",1947,"First African-American full-time faculty member at a predominantly white law school","William Robert Ming","African-American Firsts","Law",0,153,0,0,"William Robert Ming"
"154",1947,"First African-American female member of the U.S. House and Senate press galleries","Alice Allison Dunnigan","Female African American Firsts","Social & Jobs",1,154,0,0,"Alice Allison Dunnigan"
"155",1948,"First African-American man to receive an Oscar","James Baskett","African-American Firsts","Arts & Entertainment",0,155,0,0,"James Baskett"
"156",1948,"First African-American U.S. Navy aviator","Jesse L. Brown","African-American Firsts","Military",0,156,1,0,"Jesse L. Brown"
"157",1948,"First African-American composer to have an opera performed by a major U.S. company","William Grant Still","African-American Firsts","Arts & Entertainment",0,157,0,0,"William Grant Still"
"158",1948,"First African-American woman to win an Olympic gold medal","Alice Coachman","Female African American Firsts","Education & Science",1,158,0,0,"Alice Coachman"
"159",1948,"First African-American since Reconstruction to enroll at a traditionally white university of the South","Silas Hunt","African-American Firsts","Education & Science",0,159,0,0,"Silas Hunt"
"160",1948,"First known African-American star of a regularly scheduled network television series","Bob Howard, The Bob Howard Show","African-American Firsts","Arts & Entertainment",0,160,0,0,"Bob Howard, The Bob Howard Show"
"161",1948,"First African-American to star in network television sitcom","Amanda Randolph, The Laytons","African-American Firsts","Arts & Entertainment",0,161,0,0,"Amanda Randolph, The Laytons"
"162",1948,"First African-American male to graduate from Oregon State College","William Tebeau","African-American Firsts","Education & Science",0,162,0,0,"William Tebeau"
"163",1948,"First African-American female reporter to travel with a U.S. president ","Alice Allison Dunnigan","Female African American Firsts","Social & Jobs",1,163,0,0,"Alice Allison Dunnigan"
"164",1949,"First African-American graduate of the U.S. Naval Academy","Wesley Brown","African-American Firsts","Military",0,164,0,0,"Wesley Brown"
"165",1949,"First African-American to hold rank of Ambassador of the United States","Edward R. Dudley, ambassador, and previously minister, to Liberia","African-American Firsts","Education & Science",0,165,1,0,"Edward R. Dudley, ambassador, and previously minister, to Liberia"
"166",1949,"First African-American to win an MVP award in Major League Baseball","Jackie Robinson","African-American Firsts","Education & Science",0,166,0,0,"Jackie Robinson"
"167",1949,"First African-American-owned and -operated radio station","WERD, established October 3, 1949 in Atlanta, Georgia by Jesse B. Blayton Sr","African-American Firsts","Arts & Entertainment",0,167,2,1,"WERD, established October 3, 1949 in Atlanta, Georgia by Jesse B. Blayton Sr."
"168",1949,"First African-American woman president of an NAACP chapter nationwide","Florence LeSueur of Boston's NAACP chapter","Female African American Firsts","Politics",1,168,1,0,"Florence LeSueur of Boston's NAACP chapter"
"169",1950,"First African-American to win a Tony Award","Juanita Hall","African-American Firsts","Arts & Entertainment",0,169,0,0,"Juanita Hall"
"170",1950,"First African-American to win Pulitzer Prize","Gwendolyn Brooks","African-American Firsts","Arts & Entertainment",0,170,0,0,"Gwendolyn Brooks"
"171",1950,"First African-American to win Nobel Peace Prize","Ralph Bunche","African-American Firsts","Education & Science",0,171,0,0,"Ralph Bunche"
"172",1950,"First African-American to receive a lifetime appointment as federal judge","William H. Hastie, U.S. Court of Appeals for the Third Circuit","African-American Firsts","Law",0,172,3,0,"William H. Hastie, U.S. Court of Appeals for the Third Circuit"
"173",1950,"First African-American woman to compete on the world tennis tour","Althea Gibson","Female African American Firsts","Sports",1,173,0,0,"Althea Gibson"
"174",1950,"First African-American solo singer to have a #1 hit on the Billboard charts","Nat King Cole","African-American Firsts","Arts & Entertainment",0,174,0,0,"Nat King Cole"
"175",1950,"First African-American delegate to the United Nations","Edith S. Sampson","African-American Firsts","Politics",0,175,1,0,"Edith S. Sampson"
"176",1950,"First African-American NBA basketball players","Nat Sweetwater Clifton","African-American Firsts","Education & Science",0,176,0,0,"Nat Sweetwater Clifton"
"177",1951,"First African-American named to the College Football Hall of Fame","Duke Slater, University of Iowa","African-American Firsts","Education & Science",0,177,0,0,"Duke Slater, University of Iowa"
"178",1951,"First African-American quarterback to become a regular starter for a professional football team","Bernie Custis","African-American Firsts","Sports",0,178,0,0,"Bernie Custis"
"179",1952,"First African-American driver in NASCAR","Wendell Scott","African-American Firsts","Sports",0,179,0,0,"Wendell Scott"
"180",1952,"First African-American woman elected to a U.S. state senate","Cora Brown,","Female African American Firsts","Politics",1,180,0,0,"Cora Brown,"
"181",1952,"First African-American U.S. Marine Corps aviator","Frank E. Petersen","African-American Firsts","Military",0,181,1,0,"Frank E. Petersen"
"182",1952,"First African-American woman to be nominated for a national political office","Charlotta Bass, Vice President","Female African American Firsts","Politics",1,182,0,0,"Charlotta Bass, Vice President"
"183",1952,"First African-American graduate from University of Arkansas for Medical Sciences","Edith Irby Jones","African-American Firsts","Education & Science",0,183,0,0,"Edith Irby Jones"
"184",1953,"First African-American basketball player to play in the NBA All-Star Game","Don Barksdale in the 1953 NBA All-Star Game","African-American Firsts","Education & Science",0,184,0,0,"Don Barksdale in the 1953 NBA All-Star Game"
"185",1953,"First African-American quarterback to play in the National Football League during the modern ","Willie Thrower","African-American Firsts","Education & Science",0,185,0,0,"Willie Thrower"
"186",1954,"First African-American U.S. Navy Diver","Carl Brashear","African-American Firsts","Military",0,186,0,0,"Carl Brashear"
"187",1954,"First African-American woman to be nominated for the Academy Award for Best Actress","Dorothy Dandridge","Female African American Firsts","Arts & Entertainment",1,187,0,0,"Dorothy Dandridge"
"188",1954,"First individual African-American woman as subject on the cover of Life magazine","Dorothy Dandridge, November 1, 1954","Female African American Firsts","Arts & Entertainment",1,188,0,0,"Dorothy Dandridge, November 1, 1954"
"189",1954,"First African-American page for the U.S. Supreme Court, and first to be enrolled in the Capitol Page School","Charles V. Bush","African-American Firsts","Education & Science",0,189,1,0,"Charles V. Bush"
"190",1955,"First African-American member of the Metropolitan Opera","Marian Anderson","African-American Firsts","Arts & Entertainment",0,190,0,0,"Marian Anderson"
"191",1955,"First African-American male dancer in a major ballet company","Arthur Mitchell","African-American Firsts","Arts & Entertainment",0,191,0,0,"Arthur Mitchell"
"192",1955,"First African-American singer to appear in a telecast opera","Leontyne Price in NBC's production of Tosca","African-American Firsts","Arts & Entertainment",0,192,0,0,"Leontyne Price in NBC's production of Tosca"
"193",1955,"First African-American pilot of a scheduled US airline","August Martin","African-American Firsts","Social & Jobs",0,193,0,0,"August Martin"
"194",1955,"First African-American to serve as a presidential executive assistant","E. Frederic Morrow, appointed by President Eisenhower as Administrative Officer for Special Projects","African-American Firsts","Military",0,194,2,0,"E. Frederic Morrow, appointed by President Eisenhower as Administrative Officer for Special Projects"
"195",1956,"First African-American star of a nationwide network TV show","Nat King Cole of The Nat King Cole Show, NBC","African-American Firsts","Arts & Entertainment",0,195,0,0,"Nat King Cole of The Nat King Cole Show, NBC"
"196",1956,"First African-American U.S. Secret Service agent","Charles Gittens","African-American Firsts","Law",0,196,0,0,"Charles Gittens"
"197",1956,"First African-American to win the Cy Young Award as the top pitcher in Major League Baseball, in the award's inaugural year","Don Newcombe","Female African American Firsts","Education & Science",1,197,0,0,"Don Newcombe"
"198",1957,"First African-American woman Wimbledon Tennis Champion","Althea Gibson","Female African American Firsts","Sports",1,198,0,0,"Althea Gibson"
"199",1957,"First African-American assistant coach in the NFL","Lowell W. Perry","African-American Firsts","Sports",0,199,1,0,"Lowell W. Perry"
"200",1957,"First African-American to win the Best Actor Award at the Cannes Film Festival","John Kitzmiller","African-American Firsts","Education & Science",0,200,0,0,"John Kitzmiller"
"201",1957,"First African-American to win Major League Baseball's Gold Glove, in the award's inaugural year","Willie Mays","African-American Firsts","Education & Science",0,201,0,0,"Willie Mays"
"202",1958,"First African-American to reach number 1 on the Billboard Hot 100","Tommy Edwards","African-American Firsts","Arts & Entertainment",0,202,0,0,"Tommy Edwards"
"203",1958,"First African-American flight attendant","Ruth Carol Taylor","African-American Firsts","Social & Jobs",0,203,0,0,"Ruth Carol Taylor"
"204",1959,"First African-American Grammy Award winners, in the award's inaugural year","Ella Fitzgerald and Count Basie","African-American Firsts","Arts & Entertainment",0,204,0,0,"Ella Fitzgerald and Count Basie"
"205",1959,"First African-American television journalist","Louis Lomax","African-American Firsts","Arts & Entertainment",0,205,0,0,"Louis Lomax"
"206",1959,"First African-American group to reach #1 on the Billboard Hot 100","The Platters","African-American Firsts","Arts & Entertainment",0,206,0,0,"The Platters"
"207",1959,"First African-American to win a major national player of the year award in college basketball","Oscar Robertson, USBWA Player of the Year","African-American Firsts","Education & Science",0,207,0,0,"Oscar Robertson, USBWA Player of the Year"
"208",1960,"First African-American U.S. presidential candidate","Rev. Clennon King, on the Independent Afro-American party","African-American Firsts","Politics",0,208,1,0,"Rev. Clennon King, on the Independent Afro-American party"
"209",1960,"First African-American child to attend an all-white elementary school in the South","Ruby Bridges","African-American Firsts","Education & Science",0,209,0,0,"Ruby Bridges"
"210",1961,"First African-American to win the Heisman Trophy","Ernie Davis","African-American Firsts","Sports",0,210,0,0,"Ernie Davis"
"211",1961,"First African-American to serve on a U.S. district court","James Benton Parsons, appointed to the U.S. District Court for the Northern District of Illinois","African-American Firsts","Military",0,211,2,0,"James Benton Parsons, appointed to the U.S. District Court for the Northern District of Illinois"
"212",1961,"First African-American tenor to sing leading roles for the Metropolitan Opera","George Shirley","African-American Firsts","Arts & Entertainment",0,212,0,0,"George Shirley"
"213",1961,"First African-American delegate to the North Atlantic Treaty Organization","Edith S. Sampson","African-American Firsts","Politics",0,213,1,0,"Edith S. Sampson"
"214",1961,"First African-American to go over Niagara Falls","Nathan Boya a.k.a. William FitzGerald","African-American Firsts","Social & Jobs",0,214,3,0,"Nathan Boya a.k.a. William FitzGerald"
"215",1961,"First African-American to join the PGA Tour","Charlie Sifford","African-American Firsts","Sports",0,215,0,0,"Charlie Sifford"
"216",1962,"First African-American to be inducted into the Baseball Hall of Fame","Jackie Robinson","African-American Firsts","Education & Science",0,216,0,0,"Jackie Robinson"
"217",1962,"First African-American coach in Major League Baseball","John Jordan Buck O'Neil","African-American Firsts","Education & Science",0,217,0,0,"John Jordan Buck O'Neil"
"218",1962,"First African-American attorney general of a state","Edward Brooke","African-American Firsts","Military",0,218,0,0,"Edward Brooke"
"219",1963,"First African-American bank examiner for the United States Department of the Treasury","Roland Burris","African-American Firsts","Politics",0,219,0,0,"Roland Burris"
"220",1963,"First African-American named as Time magazine's Man of the Year","Martin Luther King Jr","African-American Firsts","Arts & Entertainment",0,220,1,1,"Martin Luther King Jr."
"221",1963,"First African-American police officer of the NYPD to be named a precinct commander","Lloyd Sealy, commander of the NYPD's 28th Precinct in Harlem","African-American Firsts","Military",0,221,1,0,"Lloyd Sealy, commander of the NYPD's 28th Precinct in Harlem"
"222",1963,"First African-American to be named American League MVP","Elston Howard","African-American Firsts","Education & Science",0,222,0,0,"Elston Howard"
"223",1963,"First African-American chess master","Walter Harris","African-American Firsts","Social & Jobs",0,223,0,0,"Walter Harris"
"224",1963,"First African-American to appear as a series regular on a primetime dramatic television series","Cicely Tyson, East Side/West Side","African-American Firsts","Arts & Entertainment",0,224,0,0,"Cicely Tyson, East Side/West Side"
"225",1963,"First African-American to be nominated for a Primetime Emmy Award","Diahann Carroll, for Outstanding Single Performance by an Actress in a Lead Role, for episode A Horse Has a Big Head, Let Him Worry of Naked City","African-American Firsts","Arts & Entertainment",0,225,0,1,"Diahann Carroll, for Outstanding Single Performance by an Actress in a Lead Role, for episode A Horse Has a Big Head, Let Him Worry of Naked City."
"226",1963,"First African-Americans inducted to the Basketball Hall of Fame","New York Renaissance, inducted as a team.","African-American Firsts","Education & Science",0,226,1,0,"New York Renaissance, inducted as a team."
"227",1963,"First African-American to graduate from the U.S. Air Force Academy","Charles V. Bush","African-American Firsts","Military",0,227,2,0,"Charles V. Bush"
"228",1964,"First African-American pilot for a major commercial airline","David Harris, American Airlines","African-American Firsts","Social & Jobs",0,228,0,0,"David Harris, American Airlines"
"229",1964,"First movie with African-American interracial marriage","One Potato, Two Potato, actors Bernie Hamilton and Barbara Barrie, written by Orville H. Hampton, Raphael Hayes, directed by Larry Peerce","African-American Firsts","Arts & Entertainment",0,229,1,1,"One Potato, Two Potato, actors Bernie Hamilton and Barbara Barrie, written by Orville H. Hampton, Raphael Hayes, directed by Larry Peerce."
"230",1964,"First African-American baseball player to be named the Major League Baseball World Series MVP","Bob Gibson, St. Louis Cardinals","African-American Firsts","Education & Science",0,230,1,0,"Bob Gibson, St. Louis Cardinals"
"231",1965,"First African-American nationally syndicated cartoonist","Morrie Turner","African-American Firsts","Arts & Entertainment",0,231,0,0,"Morrie Turner"
"232",1965,"First African-American title character of a comic book series","Lobo","African-American Firsts","Arts & Entertainment",0,232,0,0,"Lobo"
"233",1965,"First African-American star of a network television drama","Bill Cosby, I Spy","African-American Firsts","Arts & Entertainment",0,233,0,0,"Bill Cosby, I Spy"
"234",1965,"First African-American cast member of a daytime soap opera","Micki Grant who played Peggy Nolan Harris on Another World until 1972","African-American Firsts","Arts & Entertainment",0,234,1,0,"Micki Grant who played Peggy Nolan Harris on Another World until 1972"
"235",1965,"First African-American Playboy Playmate centerfold","Jennifer Jackson","African-American Firsts","Social & Jobs",0,235,0,0,"Jennifer Jackson"
"236",1965,"First African-American U.S. Air Force General","Benjamin Oliver Davis Jr.","African-American Firsts","Military",0,236,1,1,"Benjamin Oliver Davis Jr.."
"237",1965,"First African-American woman Ambassador of the United States","Patricia Roberts Harris, ambassador to Luxembourg","Female African American Firsts","Education & Science",1,237,0,0,"Patricia Roberts Harris, ambassador to Luxembourg"
"238",1965,"First African-American NFL official","Burl Toler, field judge/head linesman","African-American Firsts","Sports",0,238,0,0,"Burl Toler, field judge/head linesman"
"239",1965,"First African-American to win a national chess championship","Frank Street Jr.","African-American Firsts","Social & Jobs",0,239,1,1,"Frank Street Jr.."
"240",1965,"First African-American United States Solicitor General","Thurgood Marshall","African-American Firsts","Military",0,240,0,0,"Thurgood Marshall"
"241",1966,"First African-American male to be nominated for a Primetime Emmy Award and first African-American to win a Primetime Emmy Award","Bill Cosby, I Spy","African-American Firsts","Arts & Entertainment",0,241,0,0,"Bill Cosby, I Spy"
"242",1966,"First African-American coach in the National Basketball Association","Bill Russell","African-American Firsts","Education & Science",0,242,0,0,"Bill Russell"
"243",1966,"First African-American mayor of a U.S. city","Robert C. Henry,","African-American Firsts","Politics",0,243,1,0,"Robert C. Henry,"
"244",1966,"First African-American model on the cover of a Vogue ","Donyale Luna","African-American Firsts","Arts & Entertainment",0,244,0,0,"Donyale Luna"
"245",1966,"First post-Reconstruction African-American elected to the U.S. Senate ","Edward Brooke","African-American Firsts","Social & Jobs",0,245,0,0,"Edward Brooke"
"246",1966,"First African-American Cabinet secretary","Robert C. Weaver","African-American Firsts","Politics",0,246,1,0,"Robert C. Weaver"
"247",1966,"First African-American Major League Baseball umpire","Emmett Ashford","African-American Firsts","Education & Science",0,247,0,0,"Emmett Ashford"
"248",1966,"First African-American NFL broadcaster","Lowell W. Perry","African-American Firsts","Sports",0,248,1,0,"Lowell W. Perry"
"249",1966,"First African-American fire commissioner of a major U.S. City","Robert O. Lowery of the New York City Fire Department","African-American Firsts","Politics",0,249,1,0,"Robert O. Lowery of the New York City Fire Department"
"250",1967,"First African-American elected mayor of a large US city","Carl B. Stokes","African-American Firsts","Politics",0,250,1,0,"Carl B. Stokes"
"251",1967,"First African-American appointed to the Supreme Court of the United States","Thurgood Marshall","African-American Firsts","Politics",0,251,0,0,"Thurgood Marshall"
"252",1967,"First African-American selected for astronaut training","Robert Henry Lawrence Jr","African-American Firsts","Education & Science",0,252,1,1,"Robert Henry Lawrence Jr."
"253",1967,"First African-American to be inducted into the Pro Football Hall of Fame","Emlen Tunnell","African-American Firsts","Sports",0,253,0,0,"Emlen Tunnell"
"254",1967,"First African-American interracial kiss on network television","Entertainers Nancy Sinatra","African-American Firsts","Arts & Entertainment",0,254,0,0,"Entertainers Nancy Sinatra"
"255",1968,"Best total drama interracial kiss on a network television drama","Uhura, played by Nichelle Nichols","African-American Firsts","Arts & Entertainment",0,255,0,0,"Uhura, played by Nichelle Nichols"
"256",1968,"First African-American woman elected to U.S. House of Representatives","Shirley Chisholm","Female African American Firsts","Politics",1,256,0,0,"Shirley Chisholm"
"257",1968,"First African-American appointed as a United States Assistant Secretary of State","Barbara M. Watson","African-American Firsts","Politics",0,257,1,0,"Barbara M. Watson"
"258",1968,"First African-American to start at quarterback in the modern era of professional football","Marlin Briscoe","African-American Firsts","Education & Science",0,258,0,0,"Marlin Briscoe"
